{
  "template_id": "acceptance-phone-collab-demo",
  "version": 1,
  "name": "Acceptance Phone Collaboration Demo",
  "status": "published",
  "description": "Visual acceptance DAG for phone initiated task, registry-aware agents, approval gate, and final summary",
  "workspace_scope": "acceptance",
  "input_schema": {
    "properties": {
      "audience": {
        "type": "string",
        "title": "Audience"
      },
      "priority": {
        "title": "Priority",
        "enum": [
          "low",
          "medium",
          "high"
        ],
        "type": "string"
      },
      "goal": {
        "type": "string",
        "title": "Goal"
      }
    },
    "type": "object",
    "required": [
      "goal",
      "audience"
    ]
  },
  "policy": {
    "budget_policy": {},
    "max_parallel_nodes": 2,
    "default_timeout_seconds": 900,
    "approval_policy": {
      "requires_phone_review": true
    }
  },
  "agent_profile_bindings": {
    "acceptance-writer-agent": "legacy-writer",
    "acceptance-review-agent": "legacy-review",
    "acceptance-research-agent": "legacy-research"
  },
  "nodes": [
    {
      "parallelism": 1,
      "agent_profile": "acceptance-research-agent",
      "id": "node_research",
      "type": "agent_task",
      "retry_policy": {
        "backoff_seconds": 5,
        "max_attempts": 1
      },
      "config": {
        "allowed_tools": [
          "web",
          "read"
        ],
        "output_contract": {
          "expected_artifacts": [
            "research-notes"
          ]
        }
      },
      "timeout_seconds": 900,
      "approval_kind": null,
      "name": "Collect Context",
      "human_input_schema": null,
      "allowed_skills": [
        "acceptance-research"
      ]
    },
    {
      "parallelism": 1,
      "agent_profile": "acceptance-writer-agent",
      "id": "node_write",
      "type": "agent_task",
      "retry_policy": {
        "backoff_seconds": 5,
        "max_attempts": 1
      },
      "config": {
        "allowed_tools": [
          "read",
          "write"
        ],
        "output_contract": {
          "expected_artifacts": [
            "summary-draft"
          ]
        }
      },
      "timeout_seconds": 900,
      "approval_kind": null,
      "name": "Draft Summary",
      "human_input_schema": null,
      "allowed_skills": [
        "acceptance-writing"
      ]
    },
    {
      "parallelism": 1,
      "agent_profile": "acceptance-review-agent",
      "id": "node_phone_review",
      "type": "agent_task",
      "retry_policy": {
        "backoff_seconds": 5,
        "max_attempts": 1
      },
      "config": {
        "allowed_tools": [
          "read"
        ],
        "output_contract": {
          "expected_artifacts": [
            "review-decision"
          ]
        }
      },
      "timeout_seconds": 600,
      "approval_kind": "human_review",
      "name": "Phone Review Gate",
      "human_input_schema": null,
      "allowed_skills": [
        "acceptance-review"
      ]
    },
    {
      "parallelism": 1,
      "agent_profile": null,
      "id": "node_end",
      "type": "end",
      "retry_policy": {
        "backoff_seconds": 0,
        "max_attempts": 0
      },
      "config": {},
      "timeout_seconds": 60,
      "approval_kind": null,
      "name": "Done",
      "human_input_schema": null,
      "allowed_skills": []
    }
  ],
  "edges": [
    {
      "label": "context ready",
      "from": "node_research",
      "to": "node_write",
      "condition": null
    },
    {
      "label": "draft ready",
      "from": "node_write",
      "to": "node_phone_review",
      "condition": null
    },
    {
      "label": "approved",
      "from": "node_phone_review",
      "to": "node_end",
      "condition": null
    }
  ],
  "metadata": {
    "demo": "phone-collaboration",
    "domain": "acceptance",
    "owner": "my-mate",
    "versioning": {
      "family_id": "acceptance-phone-collab-demo",
      "root_template_id": "acceptance-phone-collab-demo",
      "source_template_id": null,
      "source_version": null,
      "previous_template_id": null,
      "previous_version": null,
      "derivation_kind": "initial",
      "generation": 1
    }
  },
  "created_at": "2026-06-07T17:04:37.888Z",
  "updated_at": "2026-06-07T17:04:37.898Z",
  "published_at": "2026-06-07T17:04:37.898Z"
}
