{
  "template_id": "followup-daily",
  "version": 1,
  "name": "Followup Daily",
  "status": "published",
  "description": "Daily customer follow-up workflow",
  "workspace_scope": "default",
  "input_schema": {
    "type": "object",
    "properties": {
      "customer_id": {
        "type": "string"
      },
      "priority": {
        "type": "string"
      }
    },
    "required": [
      "customer_id"
    ]
  },
  "policy": {
    "max_parallel_nodes": 1,
    "default_timeout_seconds": 600,
    "budget_policy": {},
    "approval_policy": {}
  },
  "agent_profile_bindings": {
    "research_worker": "research_worker"
  },
  "nodes": [
    {
      "id": "node_collect",
      "name": "Collect Context",
      "type": "agent_task",
      "agent_profile": "research_worker",
      "allowed_skills": [
        "web",
        "summarize"
      ],
      "config": {},
      "retry_policy": {
        "max_attempts": 1,
        "backoff_seconds": 5
      },
      "timeout_seconds": 300,
      "parallelism": 1,
      "approval_kind": null,
      "human_input_schema": null
    },
    {
      "id": "node_end",
      "name": "End",
      "type": "end",
      "agent_profile": null,
      "allowed_skills": [],
      "config": {},
      "retry_policy": {
        "max_attempts": 0,
        "backoff_seconds": 0
      },
      "timeout_seconds": 60,
      "parallelism": 1,
      "approval_kind": null,
      "human_input_schema": null
    }
  ],
  "edges": [
    {
      "from": "node_collect",
      "to": "node_end",
      "condition": null,
      "label": null
    }
  ],
  "metadata": {
    "domain": "crm"
  },
  "created_at": "2026-06-06T10:23:42.543Z",
  "updated_at": "2026-06-06T10:23:53.145Z",
  "published_at": "2026-06-06T10:23:53.145Z"
}
